{
  "schemaVersion": 1,
  "title": "AR Atrium",
  "description": "A living collection of apps, tools, libraries and things learned along the way.",
  "projects": [
    "apps/card-nest.json",
    "apps/policy-hub.json",
    "apps/office-orbit.json",
    "apps/wiki.json",
    "apps/metro-pocket.json",
    "apps/spendzo.json",
    "apps/ping-metric.json",
    "apps/globee.json",
    "apps/qurio.json",
    "apps/arblogz.json",
    "apps/vault-nest.json",
    "apps/office-pulse.json",
    "apps/lingua-log.json",
    "apps/ar-tamil-jathagam.json",
    "apps/birthday-buddy.json",
    "apps/expenzo.json",
    "apps/who-called.json",
    "apps/converter.json",
    "apps/recipe-atlas.json",
    "apps/ar-portfolio.json",
    "apps/svg-forge.json",
    "apps/lexora.json",
    "apps/wifi-chat.json",
    "apps/folder-flow.json",
    "apps/mozhi-type.json",
    "apps/glyph-forge.json",
    "apps/universal-calendar.json",
    "apps/byteschool.json",
    "apps/resume-builder.json",
    "apps/ng-pdf-rough-work.json",
    "apps/image-local-upload.json",
    "apps/ar-popover.json",
    "apps/single-spa-showcase.json",
    "apps/local-tell.json",
    "apps/stillora.json",
    "apps/flowra.json",
    "apps/link-deck.json",
    "apps/life-leaf.json",
    "apps/click2chat.json",
    "apps/arflix.json",
    "apps/personix.json",
    "apps/scrollix.json",
    "apps/artamizhsolai.json",
    "apps/care-chime.json",
    "apps/docker-learning-series.json",
    "apps/microfrontend-fundamentals.json",
    "apps/angular-playground.json",
    "apps/angular-lib-demo.json",
    "apps/ng-my-libraries.json",
    "apps/ng-rough-work.json",
    "apps/angular-22.json",
    "apps/angular-change-detection.json",
    "apps/angular-deferrable.json",
    "apps/angular-infinite-scroll.json",
    "apps/angular-model-signal.json",
    "apps/angular-graphql-lab.json",
    "apps/ng-template-depth.json",
    "apps/directive-deep-dive.json",
    "apps/pipe-deep-dive.json",
    "apps/ng-service-deep-dive.json",
    "apps/ng-lifecycle.json",
    "apps/ng-dropdown-ngtemplateoutlets.json",
    "apps/ng-feature-pagination.json",
    "apps/ng14-standalone-demo.json",
    "apps/ng16-signal-milestone-release.json",
    "apps/ngrx-module-based.json",
    "apps/ngrx-standalone.json",
    "apps/ng-dev-testing.json",
    "apps/angular-testing.json",
    "apps/angular-testing-2.json",
    "apps/angular-tetsing-1.json",
    "apps/angular-study.json",
    "apps/angular-study-services.json",
    "apps/angular-study-pipes.json",
    "apps/angular-study-http.json",
    "apps/angular-study-routing.json",
    "apps/pdf-features-poc.json"
  ],
  "repositories": "repositories.json",
  "hosting": "hosting-apps.json",
  "taxonomy": "project-types.json",
  "policyHub": {
    "repository": "actionanand/policy-hub",
    "sourceUrl": "https://raw.githubusercontent.com/actionanand/policy-hub/master/docs/.vitepress/data/apps.ts",
    "websiteUrl": "https://actionanand.github.io/policy-hub/",
    "snapshot": "generated/policy-hub.json"
  },
  "tagline": "One space. Every creation."
}
